CODE;ENGLISH;FRENCH;GERMAN;POLISH;SPANISH;HUNGARIAN;CZECH;HUNGARIAN;DUTCH;PORTUGUESE;RUSSIAN;FINNISH;;x;;;;;;;;;;;;;;;;
abolish_the_russian_american_company_title;Abolish the Russian American Company;;;;;;;;;;;;;;;;;;;;;;x;;;;
abolish_the_russian_american_company_desc;It is time to officially dissolve the Russian American company and absorb its lands into the Russian Empire;;;;;;;;;;;;;;;;;;;;;;x;;;;
nepoleon_returns_title;Re-instate Napoleon;;;;;;;;;;;;;;;;;;;;;;x;;;;
nepoleon_returns_desc;Now we controll the island of st.helana, we have an oppertunity to rescue Napoleon from the island and re-instate him as the rightfull leader of France;;;;;;;;;;;;;;;;;;;;;;x;;;;
french_claims_title;Restore the claims of the French Empire;;;;;;;;;;;;;;;;;;;;;;x;;;;
french_claims_desc;With Napoleons glorious return, we can now restore our rightfull claim to the Spanish controlled region of Barcelona, and the Dutch region of Wallonia;;;;;;;;;;;;;;;;;;;;;;x;;;;